{
  "$schema": "https://json-schema.org/draft/2020-12/schema",
  "$id": "https://aeternitrak.com/qa/vector-suite.schema.json",
  "title": "AeterniTrak QA — suite de vecteurs de conformité",
  "description": "Contrat de fichier pour qa/vectors/**/*.vectors.json. Un fichier = une suite ; une suite = un adaptateur d'implémentation ; un cas = une opération, une entrée, une attente. Voir qa/vectors/README.md.",
  "type": "object",
  "required": [
    "suite",
    "version",
    "issued_by",
    "issued_at",
    "status",
    "spec",
    "adapter",
    "description",
    "cases"
  ],
  "additionalProperties": false,
  "properties": {
    "$schema": {
      "type": "string"
    },
    "suite": {
      "type": "string",
      "description": "Identifiant hiérarchique de la suite (domaine.sujet[.variante]).",
      "pattern": "^[a-z0-9]+(\\.[a-z0-9-]+)+$"
    },
    "version": {
      "type": "string",
      "pattern": "^[0-9]+\\.[0-9]+\\.[0-9]+$"
    },
    "issued_by": {
      "enum": [
        "claude",
        "bushi-16"
      ]
    },
    "issued_at": {
      "type": "string",
      "pattern": "^[0-9]{4}-[0-9]{2}-[0-9]{2}$"
    },
    "status": {
      "enum": [
        "draft",
        "approved"
      ],
      "description": "approved = vecteur officiel immuable (modification uniquement sur arbitrage Kudoro) ; draft = proposé, modifiable jusqu'à l'approbation de Claude AI."
    },
    "spec": {
      "type": "array",
      "minItems": 1,
      "items": {
        "type": "string"
      }
    },
    "adapter": {
      "type": "string",
      "description": "Nom de l'adaptateur d'implémentation attendu par le harnais (qa/harness/adapters/<adapter>.mjs). Absent à l'exécution => tous les cas sont RED.",
      "pattern": "^[a-z0-9]+(\\.[a-z0-9-]+)*$"
    },
    "description": {
      "type": "string"
    },
    "cases": {
      "type": "array",
      "minItems": 1,
      "items": {
        "$ref": "#/$defs/case"
      }
    },
    "retired": {
      "type": "array",
      "description": "Cas retirés : l'identifiant reste réservé et n'est jamais réattribué. Un retrait exige une décision consignée dans DECISIONS-KUDORO.md.",
      "items": {
        "type": "object",
        "required": [
          "id",
          "reason",
          "decision"
        ],
        "additionalProperties": false,
        "properties": {
          "id": {
            "type": "string",
            "pattern": "^[A-Z]{2,8}-[A-Z0-9]{2,12}-[0-9]{3}$"
          },
          "reason": {
            "type": "string",
            "minLength": 10
          },
          "decision": {
            "type": "string",
            "minLength": 3
          },
          "retired_at": {
            "type": "string",
            "pattern": "^[0-9]{4}-[0-9]{2}-[0-9]{2}$"
          }
        }
      }
    }
  },
  "$defs": {
    "case": {
      "type": "object",
      "required": [
        "id",
        "title",
        "op",
        "input",
        "expect",
        "rule"
      ],
      "additionalProperties": false,
      "properties": {
        "id": {
          "type": "string",
          "description": "Identifiant unique et stable dans tout le dépôt : DOMAINE-SOUSTYPE-NNN.",
          "pattern": "^[A-Z]{2,8}-[A-Z0-9]{2,12}-[0-9]{3}$"
        },
        "title": {
          "type": "string",
          "minLength": 3
        },
        "op": {
          "type": "string",
          "description": "Opération soumise à l'adaptateur : encode | decode | reject-encode | reject-decode | canonicalize | evaluate | sign | verify | ...",
          "pattern": "^[a-z]+(-[a-z]+)*$"
        },
        "input": {
          "description": "Entrée de l'opération (notation AVN pour les éléments CBOR, JSON natif sinon)."
        },
        "expect": {
          "type": "object",
          "description": "Attente exacte : {hex,len,sha256} | {utf8,hex,len,sha256} | {item} | {error} | {verdict,reasons} ...",
          "minProperties": 1
        },
        "rule": {
          "type": "string",
          "description": "Référence normative ou règle de projet justifiant l'attente."
        },
        "tags": {
          "type": "array",
          "items": {
            "type": "string"
          },
          "uniqueItems": true
        },
        "notes": {
          "type": "string"
        }
      }
    }
  }
}
